Title,Subreddit,Score,Upvote Ratio,Comments,Created Date,Author,Text Content,Awards,Permalink,Post ID,Source,Collected At,Sentiment
Just started a FT job after 7 years of running a small business... and I just feel relieved,smallbusiness,607,0.99,89,2025-02-27 08:52:03,pizzapriorities,"Posting this for anyone else who may be in a similar situation.

I just started a full-time job at a larger (>1500 employee) business after seven years of first freelancing and then running a small marketing agency as a US S-Corp. I'm a dad in my forties and also have eldercare requirements outside of parenting stuff.

I feel more relieved and more like I've taken a 200 lb. backpack off my back than anything else.

For my business, I went from generating $150,000+ annual revenue in 2019/2020 wit",0,https://reddit.com/r/smallbusiness/comments/1izg9g6/just_started_a_ft_job_after_7_years_of_running_a/,1izg9g6,Reddit (PRAW/JSON),2025-08-20 00:29:52,Neutral
"Small business owners in your forties, how are you all doing?",smallbusiness,179,0.96,248,2024-11-09 18:55:07,pizzapriorities,"43 year old dude here. I run a small marketing agency.

So here's where I'm at:  
1. As I'm getting older, I'm less excited about work taking up my whole life than I was in my 30s or 20s. I want to spend time with my wife. I want to spend time with my son. I want to have hobbies and be outdoors and do stuff besides work.

2. The economy is so damn weird right now. 2023 was a terror year for us, we grossed only US$65k or so (a typical year is $120k-$150 before expenses) and I only took home a $40",0,https://reddit.com/r/smallbusiness/comments/1gnnj5z/small_business_owners_in_your_forties_how_are_you/,1gnnj5z,Reddit (PRAW/JSON),2025-08-20 00:29:52,Neutral
I’ve made 50k in last two months of my small business. What’s next?,smallbusiness,262,0.91,120,2025-03-06 20:21:15,Spepmo,"The headline is more for attention, but it’s true. 52k gross profit. 26k net. I started a small maintenance and repair business and went full time November 1st 2024. So far I have partnered with a roofing company, a high end HOA, and Wingstop to cover 10 of there stores in my area. I thought I was just going to be a one man handyman type but it looks like I will the opportunity to get a bit bigger if I want. I have one guy I employ pretty much full time and others I used as needed. I’m looking t",0,https://reddit.com/r/smallbusiness/comments/1j5br6p/ive_made_50k_in_last_two_months_of_my_small/,1j5br6p,Reddit (PRAW/JSON),2025-08-20 00:29:52,Neutral
"Promote your business, week of July 8, 2024",smallbusiness,39,0.94,250,2024-07-07 22:38:42,Charice,"Post business promotion messages here including special offers especially if you cater to small business.  

**Be considerate. Make your message concise.**    

**Note:** To prevent your messages from being flagged by the autofilter, don't use shortened URLs.",0,https://reddit.com/r/smallbusiness/comments/1dxxzfd/promote_your_business_week_of_july_8_2024/,1dxxzfd,Reddit (PRAW/JSON),2025-08-20 00:29:52,Neutral
"Promote your business, week of July 1, 2024",smallbusiness,40,0.96,252,2024-06-30 22:31:52,Charice,"Post business promotion messages here including special offers especially if you cater to small business.  

**Be considerate. Make your message concise.**    

**Note:** To prevent your messages from being flagged by the autofilter, don't use shortened URLs.",0,https://reddit.com/r/smallbusiness/comments/1dsi7ra/promote_your_business_week_of_july_1_2024/,1dsi7ra,Reddit (PRAW/JSON),2025-08-20 00:29:52,Neutral
"Promote your business, week of August 26, 2024",smallbusiness,59,0.96,182,2024-08-25 22:30:34,Charice,"Post business promotion messages here including special offers especially if you cater to small business.  

**Be considerate. Make your message concise.**    

**Note:** To prevent your messages from being flagged by the autofilter, don't use shortened URLs.",0,https://reddit.com/r/smallbusiness/comments/1f1dkun/promote_your_business_week_of_august_26_2024/,1f1dkun,Reddit (PRAW/JSON),2025-08-20 00:29:52,Neutral
"Promote your business, week of July 29, 2024",smallbusiness,30,0.96,217,2024-07-28 22:06:34,Charice,"Post business promotion messages here including special offers especially if you cater to small business.  

**Be considerate. Make your message concise.**    

**Note:** To prevent your messages from being flagged by the autofilter, don't use shortened URLs.",0,https://reddit.com/r/smallbusiness/comments/1eeo3es/promote_your_business_week_of_july_29_2024/,1eeo3es,Reddit (PRAW/JSON),2025-08-20 00:29:52,Neutral
"Promote your business, week of December 2, 2024",smallbusiness,24,1.0,150,2024-12-01 21:20:08,Charice,"Post business promotion messages here including special offers especially if you cater to small business.  

**Be considerate. Make your message concise.**    

**Note:** To prevent your messages from being flagged by the autofilter, don't use shortened URLs.",0,https://reddit.com/r/smallbusiness/comments/1h4kcuw/promote_your_business_week_of_december_2_2024/,1h4kcuw,Reddit (PRAW/JSON),2025-08-20 00:29:52,Neutral
"Promote your business, week of October 21, 2024",smallbusiness,28,0.98,169,2024-10-20 22:15:26,Charice,"Post business promotion messages here including special offers especially if you cater to small business.  

**Be considerate. Make your message concise.**    

**Note:** To prevent your messages from being flagged by the autofilter, don't use shortened URLs.",0,https://reddit.com/r/smallbusiness/comments/1g8f9xa/promote_your_business_week_of_october_21_2024/,1g8f9xa,Reddit (PRAW/JSON),2025-08-20 00:29:52,Neutral
"Promote your business, week of August 5, 2024",smallbusiness,32,0.95,196,2024-08-04 22:48:18,Charice,"Post business promotion messages here including special offers especially if you cater to small business.  

**Be considerate. Make your message concise.**    

**Note:** To prevent your messages from being flagged by the autofilter, don't use shortened URLs.",0,https://reddit.com/r/smallbusiness/comments/1ekd5bo/promote_your_business_week_of_august_5_2024/,1ekd5bo,Reddit (PRAW/JSON),2025-08-20 00:29:52,Neutral
"Promote your business, week of December 23, 2024",smallbusiness,20,0.96,136,2024-12-22 20:30:13,Charice,"Post business promotion messages here including special offers especially if you cater to small business.  

**Be considerate. Make your message concise.**    

**Note:** To prevent your messages from being flagged by the autofilter, don't use shortened URLs.",0,https://reddit.com/r/smallbusiness/comments/1hkcyor/promote_your_business_week_of_december_23_2024/,1hkcyor,Reddit (PRAW/JSON),2025-08-20 00:29:52,Neutral
"Promote your business, week of December 16, 2024",smallbusiness,19,0.92,138,2024-12-15 21:50:38,Charice,"Post business promotion messages here including special offers especially if you cater to small business.  

**Be considerate. Make your message concise.**    

**Note:** To prevent your messages from being flagged by the autofilter, don't use shortened URLs.",0,https://reddit.com/r/smallbusiness/comments/1hf9f1w/promote_your_business_week_of_december_16_2024/,1hf9f1w,Reddit (PRAW/JSON),2025-08-20 00:29:52,Neutral
"Promote your business, week of June 10, 2024",smallbusiness,39,0.96,212,2024-06-09 23:06:53,Charice,"Post business promotion messages here including special offers especially if you cater to small business.  

**Be considerate. Make your message concise.**    

**Note:** To prevent your messages from being flagged by the autofilter, don't use shortened URLs.",0,https://reddit.com/r/smallbusiness/comments/1dcbnyz/promote_your_business_week_of_june_10_2024/,1dcbnyz,Reddit (PRAW/JSON),2025-08-20 00:29:52,Neutral
"Promote your business, week of December 30, 2024",smallbusiness,24,1.0,120,2024-12-29 22:11:16,Charice,"Post business promotion messages here including special offers especially if you cater to small business.  

**Be considerate. Make your message concise.**    

**Note:** To prevent your messages from being flagged by the autofilter, don't use shortened URLs.",0,https://reddit.com/r/smallbusiness/comments/1hpdkh3/promote_your_business_week_of_december_30_2024/,1hpdkh3,Reddit (PRAW/JSON),2025-08-20 00:29:52,Neutral
"Promote your business, week of November 25, 2024",smallbusiness,24,1.0,123,2024-11-24 22:00:30,Charice,"Post business promotion messages here including special offers especially if you cater to small business.  

**Be considerate. Make your message concise.**    

**Note:** To prevent your messages from being flagged by the autofilter, don't use shortened URLs.",0,https://reddit.com/r/smallbusiness/comments/1gz91ld/promote_your_business_week_of_november_25_2024/,1gz91ld,Reddit (PRAW/JSON),2025-08-20 00:29:52,Neutral
Is vending machine business still worth it? (2024),entrepreneur,116,0.88,179,2024-07-21 00:34:51,Key-Anxiety8451,I always wanted to be an entrepreneur. I want to be included in many projects in the future such as real estate and businesses. Im hoping start off small with a vending machine.,0,https://reddit.com/r/Entrepreneur/comments/1e8e7ob/is_vending_machine_business_still_worth_it_2024/,1e8e7ob,Reddit (PRAW/JSON),2025-08-20 00:29:52,Neutral
How I went from $27 to $3K as a solopreneur still in a 9-5,entrepreneur,1000,0.93,281,2024-10-14 16:03:40,jottrled,"My journey started back in November 2023.

I was scrolling through Twitter and YouTube and saw a word that I had never come across before. Solopreneur.

The word caught my eye. Mainly because I was pretty sure I knew what it meant even though it's not a word you'll find in the dictionary. I liked what it was describing. A solo entrepreneur. A one man business.

It completely resonated with me. As a software engineer by trade I'm used to working alone, especially since the pandemic hit and we wer",0,https://reddit.com/r/Entrepreneur/comments/1g3pa5c/how_i_went_from_27_to_3k_as_a_solopreneur_still/,1g3pa5c,Reddit (PRAW/JSON),2025-08-20 00:29:52,Neutral
I run a photo booth rental business that generates $400k annually. AMA,entrepreneur,1056,0.94,540,2023-11-27 15:32:26,maydaybutton,"Been in the photo booth industry for nearly 10 years and will finish the year at \~$400k in gross revenue (set to do over half a mil by 2024) in the wedding and events space. I don't feel like I am the expert by any means in business or entrepreneurship, but I've built a couple successful companies on a small scale, and have an MBA, so maybe I can contribute to your success. AMA!As of today, the Net operating income + owners (mine) salary come out to $157,000 and should finish the year closer to",0,https://reddit.com/r/Entrepreneur/comments/185cuxg/i_run_a_photo_booth_rental_business_that/,185cuxg,Reddit (PRAW/JSON),2025-08-20 00:29:52,Neutral
Need help scaling my small semi-online business,entrepreneur,4,1.0,9,2025-01-15 09:27:36,ElitePotato06,"I have a very small online business in which I started in November 2024. I sell made to order, customised watches. In the last month I’ve sold about £1400 worth, averaging about 2-3 orders a week. At the moment, I’m only selling on eBay, as I have a good account with good feedback, this results in shorter payouts which massively help with cash flow. 

I am looking for any advice as to how I could increase my sales. (I live and sell in the UK). There are other people selling similar things as I h",0,https://reddit.com/r/Entrepreneur/comments/1i1yjoh/need_help_scaling_my_small_semionline_business/,1i1yjoh,Reddit (PRAW/JSON),2025-08-20 00:29:52,Positive
"LA Housing Discrimination Destroys Small Business, why?",entrepreneur,0,0.5,2,2025-01-04 10:32:15,RiaBromley,"Hello  I’m a 32 year old black (from nigerian immigrant parents) entrepreneur in Los Angeles & I’m still learning a lot about the business world. I ran a rental arbitrage bed and breakfast business for 2.5 years in East Hollywood and it was profitable (160k 2023, 10% profit). Unfortunate for me, I had racist landlords. They owned a building I requested to expand my business into. Early December 2023 we agreed to a deal thru email for this expansion but then I was getting the run around until mar",0,https://reddit.com/r/Entrepreneur/comments/1htgszz/la_housing_discrimination_destroys_small_business/,1htgszz,Reddit (PRAW/JSON),2025-08-20 00:29:52,Neutral
Is it a dumb idea in 2024 to start a small business making guitars from my shed in the garden?,entrepreneur,12,0.88,27,2023-12-18 19:05:34,TouchMySwollenFace,I’ve made a couple before and it gives me pleasure doing it. I was just wondering if this was something I could turn into a business. Thanks.,0,https://reddit.com/r/Entrepreneur/comments/18lnsmy/is_it_a_dumb_idea_in_2024_to_start_a_small/,18lnsmy,Reddit (PRAW/JSON),2025-08-20 00:29:52,Neutral
giving up on life,entrepreneur,299,0.94,224,2025-02-16 23:15:59,aj_216,"I’m a 28-year-old single male. I grew up in a small midwestern town, went to college there, and had a job lined up at a Fortune 500 tech company after graduation. Life seemed like it was on track. I worked there for 2.5 years, but then, I decided to leave for a startup job that was remote. I moved to Dallas in June of 2022, wanting more personal growth and development.

Things were fine initially, but in April 2023, I was laid off. Thankfully, I received severance and unemployment, but the job s",0,https://reddit.com/r/Entrepreneur/comments/1irbco7/giving_up_on_life/,1irbco7,Reddit (PRAW/JSON),2025-08-20 00:29:52,Neutral
I failed 7 businesses. The 8th seems to be working.,entrepreneur,591,0.91,150,2024-12-09 12:58:56,Opening_Call_1711,"Hope this post reaches the right people.

24 year old here. I've tried it all. Dropshipping, affiliates, TikTok, Instagram, YouTube channel, Pinterest, sales job, freelancing, designing, startup...

I failed in all of those attempts. Now looking back, it seems more like quitting, but please, allow me to fool myself here.

At the beginning of 2024, I was working at a startup, making almost no money working as an intern, and I used to love it. I was learning a lot about entrepreneurship and having",0,https://reddit.com/r/Entrepreneur/comments/1hafuef/i_failed_7_businesses_the_8th_seems_to_be_working/,1hafuef,Reddit (PRAW/JSON),2025-08-20 00:29:52,Positive
What are the common struggles of a small business in 2024?,entrepreneur,2,0.6,7,2024-03-08 00:14:55,No-Catch-5478,I want to create an article for my blog and I want to get a first-hand information from small entrepreneurs. I understand that it's hard to keep up now with a lot of innovations happening esp. for those who still opt for a more traditional approaches in their businesses. May you also please share your best practices as a small entrepreneur? Thank you!,0,https://reddit.com/r/Entrepreneur/comments/1b9g0l1/what_are_the_common_struggles_of_a_small_business/,1b9g0l1,Reddit (PRAW/JSON),2025-08-20 00:29:52,Positive
Execute on an app for small local businesses?,entrepreneur,5,0.86,5,2024-01-02 06:33:10,Cyrillite,"It’s 2024 and I want to learn to code. I have a simple, practical idea: I want to make a loyalty card app for my local (UK) coffee shop that still uses physical punch cards. 

I want this to be a trial run at making a product (one way or another), getting it off the ground, securing a client, and maybe even making some money out of it.

I’m coming to this with no coding skills, no prior experience in business, and having never done anything like this before. None of that bothers me, I’m happy to",0,https://reddit.com/r/Entrepreneur/comments/18wndsm/execute_on_an_app_for_small_local_businesses/,18wndsm,Reddit (PRAW/JSON),2025-08-20 00:29:52,Neutral
"I've been unemployed for the last 9 months. I need to start a business. I'm not looking for a get rich quick scheme, I'm looking for a hard work scheme, and I'm willing to put in effort, but I don't even know where to start",entrepreneur,154,0.95,268,2024-06-08 08:30:06,diffusion_throwaway,"I poured every second of every day up until now into my career. I work in the movie/advertising industries doing visual effects (VFX). I got very skilled at my job to the point where I was supervising teams of 50+ people on films that cost $100+ million.

But VFX is dead right now. I haven't had any work in 9 months. Most people haven't. I wish I could take these skills I've developed over the last 20 years (VFX, motion graphics, photography, photo retouching, videography, etc) and pivot into so",0,https://reddit.com/r/Entrepreneur/comments/1db1vr6/ive_been_unemployed_for_the_last_9_months_i_need/,1db1vr6,Reddit (PRAW/JSON),2025-08-20 00:29:52,Neutral
"My 8-month investigation and taking on Apple in Court: Their mistake wiped out our $33,680 MRR mobile business",entrepreneur,539,0.95,75,2024-05-10 22:03:05,seraleev_viktor,"Hi, I'm Viktor Seraleev, and I live in Chile. I’m founder of Sarafan Mobile Limited (team ID G5293S9UFX). We specialize in developing photo and video apps for iOS and Android, and most of our apps have consistently ranked among the top in user retention benchmarks set by AppStore Connect. However, **on September 21, 2023, our developer account was unexpectedly closed and all payments were frozen.**

→ On September 20, 2023 we had 1209 active trials and $33,680 MRR  
→ Was frozen $108,878 of hone",0,https://reddit.com/r/Entrepreneur/comments/1cp6i5s/my_8month_investigation_and_taking_on_apple_in/,1cp6i5s,Reddit (PRAW/JSON),2025-08-20 00:29:52,Neutral
"Started a content marketing agency 8 years ago - $0 to $7,863,052 (2025 update)",entrepreneur,244,0.94,64,2025-01-09 09:56:07,mr_t_forhire,"Hey friends,

My name is Tyler and for the past 8 years, I’ve been documenting my experience building a content marketing agency called Optimist.

* Year 1 — 0 to $500k ARR
* Year 2 — $500k to $1MM ARR
* Year 3 — $1MM ARR to $1.5MM(ish) ARR
* Year 4 — $3,333,686 Revenue
* Year 5 — $4,539,659 Revenue
* Year 6 — $5,974,324 Revenue
* Year 7 - $6,815,503 Revenue

(Edit: Seems like links are banned now. You can check my post history for all of my previous updates with lessons and learnings.)

# How O",0,https://reddit.com/r/Entrepreneur/comments/1hxejqw/started_a_content_marketing_agency_8_years_ago_0/,1hxejqw,Reddit (PRAW/JSON),2025-08-20 00:29:52,Neutral
How I plan to be a millionaire.,entrepreneur,141,0.82,121,2024-04-20 02:11:29,Skronrad,"**clarification: by podcast I just mean creating the opportunity to be able to have 1-on-1s with successful business owners with the primary focus and purpose of it is to educate myself with the insights and successful business tactics they’ve implemented, so that I can use those to creativity implement improvements to my own business in order to get it to a stage of successful sustainability (3-5years). Only then, really start the process of developing a side of the business that invests in oth",0,https://reddit.com/r/Entrepreneur/comments/1c8iw7k/how_i_plan_to_be_a_millionaire/,1c8iw7k,Reddit (PRAW/JSON),2025-08-20 00:29:52,Neutral
My dream is slipping away,entrepreneur,27,0.74,84,2024-11-14 11:35:31,PlaintiffSide,"In 2014, after years of online dating, I believed I knew how to fix it. In a monogamous society, groups of people naturally sort into couples (the most desirable typically get with the most desirable and the least with the least). Online dating was a hypergamous system whereby everyone seemingly has access to the most desirable people, so you have most people competing for the select few and this has been shown empirically.

In 2016, my buddy and I graduated law school but he didn’t want to prac",0,https://reddit.com/r/Entrepreneur/comments/1gr8vpu/my_dream_is_slipping_away/,1gr8vpu,Reddit (PRAW/JSON),2025-08-20 00:29:52,Neutral
Is Indeed Dead for Businesses and Staffing Firms for 2024? What's everyone using?,business,52,0.9,47,2024-04-15 13:43:48,dropsetmurphy,"Have any other companies, small businesses, or staffing companies used anything other than Indeed? I am getting screwed on Indeed this year! I am getting next to NOTHING for applicants no matter if I run jobs with a huge budget or for free I get the same results. I am not sure what is going on but I know that I need a new job board to post on. I am a medium-sized direct hire staffing firm and I recently posted over 10 jobs over the past weekend and received ONE APPLICANT, and they weren't qualif",0,https://reddit.com/r/business/comments/1c4seht/is_indeed_dead_for_businesses_and_staffing_firms/,1c4seht,Reddit (PRAW/JSON),2025-08-20 00:29:52,Neutral
Need advice on scaling small ecom business,business,5,0.86,8,2025-01-15 09:24:43,ElitePotato06,"I have a very small online business in which I started in November 2024. I sell made to order, customised watches. In the last month I’ve sold about £1400 worth, averaging about 2-3 orders a week. At the moment, I’m only selling on eBay, as I have a good account with good feedback, this results in shorter payouts which massively help with cash flow. 

I am looking for any advice as to how I could increase my sales. (I live and sell in the UK). There are other people selling similar things as I h",0,https://reddit.com/r/business/comments/1i1yhib/need_advice_on_scaling_small_ecom_business/,1i1yhib,Reddit (PRAW/JSON),2025-08-20 00:29:52,Positive
"LA Housing Discrimination Destroys Small Business, Why?",business,0,0.25,6,2025-01-04 10:36:07,RiaBromley,"Hello, I’m a 32 year old black (from nigerian immigrant parents) entrepreneur in Los Angeles & I’m still learning a lot about the business world. I ran a rental arbitrage bed and breakfast business for 2.5 years in East Hollywood and it was profitable (160k 2023, 10% profit). Unfortunate for me, I had racist landlords. They owned a building I requested to expand my business into. Early December 2023 we agreed to a deal thru email for this expansion but then I was getting the run around until mar",0,https://reddit.com/r/business/comments/1htgw3b/la_housing_discrimination_destroys_small_business/,1htgw3b,Reddit (PRAW/JSON),2025-08-20 00:29:52,Neutral
What is a good business idea tp start in 2024 from Chicago with a low investment? ,business,0,0.17,13,2024-08-23 17:38:50,No_Addendum8290,"My husband recently lost his jobs and ever since we're trying to figure out what kind of a business to start with a small investment. He's an Architect and interested in furniture business - reselling, remodeling and the like. Need some advice on what business to start with low investment. ",0,https://reddit.com/r/business/comments/1ezokox/what_is_a_good_business_idea_tp_start_in_2024/,1ezokox,Reddit (PRAW/JSON),2025-08-20 00:29:52,Positive
If you were Starting a small business with $10k?,business,0,0.5,12,2024-03-28 14:20:27,AtlantaRange,"Hello all.. Im currently a Realtor and looking to start another small business. In 2024, are their any new ventures or ideas you would recommend? I have $10k to start. ",0,https://reddit.com/r/business/comments/1bq2m6w/if_you_were_starting_a_small_business_with_10k/,1bq2m6w,Reddit (PRAW/JSON),2025-08-20 00:29:52,Positive
2024 business ideas,business,2,0.67,6,2024-01-19 14:52:29,mido3422,"These are 2 business ideas that have been floating my head for for the last couple of years:

BlindOuting:

The dating apps market is saturated with apps that rely heavily on the looks of both parties, and since most of thes apps are 70% men,  the sustainability/growth of this business model is in decline. 

My idea is to create a blind date app that rely solely on stating the characteristics of both partners. No photos. If there's match, the man decides the location and the woman decides the da",0,https://reddit.com/r/business/comments/19arzzc/2024_business_ideas/,19arzzc,Reddit (PRAW/JSON),2025-08-20 00:29:52,Neutral
Was your Degree worth it?,business,8,0.83,13,2025-06-15 20:38:41,HDmech681,"So recently i have been debating adding some formal education to my resume...

  
Here is the backstory,

I am a Journeyman (Red Seal in Canada) Heavy duty mechanic, i have been in the trade for over 15 years and have recently dove into the business side quite heavily.

I started as a contractor and was extremely successful with it, after 3 years i branched out, brought on a partner (another journeyman with extensive operations experience but no business side experience) and opened a shop in aug",0,https://reddit.com/r/business/comments/1lcfk7z/was_your_degree_worth_it/,1lcfk7z,Reddit (PRAW/JSON),2025-08-20 00:29:52,Neutral
It looks like Disney will completely cease to exist some time after April 3.,business,0,0.21,44,2024-03-30 11:46:14,Block-Busted,"You see, Nelson Peltz is now gaining all sorts of support from almost every single Disney investors/shareholders:

> **US pension fund CalPERS backs Peltz, Rasulo in Disney board battle**
> 
> The California Public Employees Retirement System (CalPERS) said on Friday it voted to elect activist investment firm Trian Fund Management's two director candidates to Walt Disney's board, in one of the most closely watched and expensive battles for corporate control.
> 
> ""CalPERS believes Walt Disney Co",0,https://reddit.com/r/business/comments/1brkwk9/it_looks_like_disney_will_completely_cease_to/,1brkwk9,Reddit (PRAW/JSON),2025-08-20 00:29:52,Neutral
