Title,Subreddit,Score,Upvote Ratio,Comments,Created Date,Author,Text Content,Awards,Permalink,Post ID,Source,Collected At,Sentiment
Any tips on creating an effective business system?,business,3,0.8,9,2024-10-27 16:51:22,SoggySausage302,I'll try to keep things brief: My dad ran a fairly successful construction company back in the day with over 100 employees. Some things happened and he wanted to retire so he sold the company but then ended up being bored and opened a interior design/carpentry firm with 4 employees. Eventually he found a passion for running cafe's and making ice cream so now he opened two locations and was planning to close the interior design/carpentry company at the start of 2024. This seemed like a good oppor,0,https://reddit.com/r/business/comments/1gdky40/any_tips_on_creating_an_effective_business_system/,1gdky40,Reddit (PRAW/JSON),2025-08-20 00:29:52,Positive
Trump Just Eliminated the $800 Duty-Free Exemption for Imports from China. It Could Be a Disaster for Small Businesses.,business,2272,0.94,385,2025-02-05 00:22:00,donquixote2000,,0,https://reddit.com/r/business/comments/1ii2uvj/trump_just_eliminated_the_800_dutyfree_exemption/,1ii2uvj,Reddit (PRAW/JSON),2025-08-20 00:29:52,Neutral
Tesla (TSLA) is not paying its bills and it is destroying small American businesses,business,2712,0.97,100,2025-08-02 13:09:51,esporx,,0,https://reddit.com/r/business/comments/1mfvr9b/tesla_tsla_is_not_paying_its_bills_and_it_is/,1mfvr9b,Reddit (PRAW/JSON),2025-08-20 00:29:52,Neutral
Advise on expanding with a partner or going as is. ,business,0,0.5,1,2024-08-23 01:47:35,Dmb1345,"This is going to take a little explaining to do so please be patient and read my story to give me some much needed advice. 

My father started a plumbing and HVAC company in 1985. Since that time he grew it into a pretty successful small business with the usual ups and downs. My brother went to work for him right out of high school while I went to college and got a degree in business finance. I have had multiple jobs through this time. My dad retired in January of 2023 and my brother bought the ",0,https://reddit.com/r/business/comments/1ez56wo/advise_on_expanding_with_a_partner_or_going_as_is/,1ez56wo,Reddit (PRAW/JSON),2025-08-20 00:29:52,Neutral
Small tax question.,business,2,1.0,8,2023-12-19 16:23:21,cresz231,Say I built up a business and sold it. I receive a check for 500k in december 2023. And deposited the check in January 2024. Which tax year will it go on?,0,https://reddit.com/r/business/comments/18mcxj7/small_tax_question/,18mcxj7,Reddit (PRAW/JSON),2025-08-20 00:29:52,Neutral
"Preparing to sell mobile app business, seeking knowledgeable buyer to mentor me on the process",business,3,1.0,0,2023-12-15 12:54:22,rockysds,"Hey all! I have a small B2C mobile app that I’m preparing to sell ~Q1 2024. Currently nets $5k/mo and growing. I’m looking for a seasoned buyer(s) in this space to help mentor me on how to best position the app for sale. 

I’ve already spoken to multiple brokers (microacquire/flippa/Empire) but am looking for somebody with a little more first hand experience.

TIA!",0,https://reddit.com/r/business/comments/18j5xyx/preparing_to_sell_mobile_app_business_seeking/,18j5xyx,Reddit (PRAW/JSON),2025-08-20 00:29:52,Positive
How many of you here are aware of the Employee Retention Credit Program by the U.S treasury,business,0,0.5,6,2022-09-27 18:18:19,altruistic_summer,"I have been talking to a lot of prospects, mostly small and medium business owners as it is a part of my job.

And I'm suprised at the amount of people who aren't aware of the ERC.

They are like; uhh... what? The Employee Retention Credit?

The ERC is also finite. The funds are slowly sinking and by 2024 it will all be gone or even faster if more businesses start claiming it!

A massive amount of cash has already been compensated, our firm alone has bought in about $2.5B worth of compensation f",0,https://reddit.com/r/business/comments/xpujmh/how_many_of_you_here_are_aware_of_the_employee/,xpujmh,Reddit (PRAW/JSON),2025-08-20 00:29:52,Neutral
